number,value,datetime_start,datetime_complete,duration,params_disable_text_lora,params_embedding_normalization,params_gradient_accumulation_steps,params_learning_rate,params_lora_alpha,params_lora_rank,params_stride_seconds,params_weight_decay,params_window_seconds,user_attrs_best_epoch,user_attrs_output_dir,user_attrs_validation_accuracy,user_attrs_validation_balanced_accuracy,user_attrs_validation_classification_loss,user_attrs_validation_macro_f1,user_attrs_validation_regression_loss,user_attrs_validation_regression_rmse,user_attrs_validation_regression_rmse_original_scale,system_attrs_fixed_params,state
0,,2026-09-09 02:40:53.018333,2026-09-09 02:41:26.285026,0 days 00:00:33.266693,False,layernorm,2,1e-05,16.0,2.0,20.0,1e-05,30.0,,,,,,,,,,"{'embedding_normalization': 'layernorm', 'disable_text_lora': False, 'lora_rank': 2, 'lora_alpha': 16, 'gradient_accumulation_steps': 2, 'learning_rate': 1e-05, 'weight_decay': 1e-05, 'window_seconds': 30.0, 'stride_seconds': 20.0}",FAIL
1,0.110106313302267,2026-09-09 02:42:47.520047,2026-09-09 02:51:30.410407,0 days 00:08:42.890360,True,batchnorm,4,5.110785052766934e-06,,,15.0,0.0001,25.0,170.0,outputs/hpo_text_regression/screening/trial-0001,0.2564102564102564,0.2645833333333333,1.3983827890493932,0.1395120031483668,0.8368285591861182,0.9147833400243568,10.033139335488606,,COMPLETE
2,0.2737283424839265,2026-09-09 02:51:30.463582,2026-09-09 03:03:20.674398,0 days 00:11:50.210816,False,batchnorm,4,8.213253373867844e-06,16.0,2.0,15.0,1e-06,25.0,130.0,outputs/hpo_text_regression/screening/trial-0002,0.5470085470085471,0.2544270833333333,1.3237275099143004,0.1916026536312849,0.6829634526256921,0.8264160287807177,9.063946431012084,,COMPLETE
3,0.2006759790051487,2026-09-09 03:03:20.725328,2026-09-09 03:16:40.321632,0 days 00:13:19.596304,False,layernorm,4,3.829982509898518e-06,16.0,1.0,20.0,1e-05,20.0,200.0,outputs/hpo_text_regression/screening/trial-0003,0.1367521367521367,0.25,1.4085150987674029,0.0601503759398496,0.7516596407084949,0.8669830682940094,9.508876577762718,,COMPLETE
4,0.3182634935106664,2026-09-09 03:16:40.371566,2026-09-09 03:24:29.565912,0 days 00:07:49.194346,False,batchnorm,4,1.6358165301626213e-05,16.0,4.0,15.0,0.0001,20.0,85.0,outputs/hpo_text_regression/screening/trial-0004,0.5213675213675214,0.3655133928571428,1.3129637954581497,0.2451923076923076,0.6410839710382453,0.8006771952780005,8.781648641012861,,COMPLETE
5,0.3139123747938361,2026-09-09 03:24:29.654632,2026-09-09 03:40:35.035155,0 days 00:16:05.380523,False,batchnorm,1,4.4277703242711426e-06,8.0,8.0,10.0,0.0001,25.0,175.0,outputs/hpo_text_regression/screening/trial-0005,0.3076923076923077,0.3403273809523809,1.4077999958625207,0.1991532976827094,0.6451756287958866,0.8032282544805596,8.80962804054575,,COMPLETE
6,0.3091821294047434,2026-09-09 03:40:35.122945,2026-09-09 03:51:53.872937,0 days 00:11:18.749992,False,batchnorm,1,5.095918665102104e-06,16.0,4.0,20.0,0.0,20.0,140.0,outputs/hpo_text_regression/screening/trial-0006,0.5555555555555556,0.3811383928571428,1.3112630151275897,0.2651946818613485,0.649623805575565,0.8059924351850736,8.839945026912476,,COMPLETE
7,0.0944296320754651,2026-09-09 03:51:53.962679,2026-09-09 03:54:28.632848,0 days 00:02:34.670169,True,layernorm,2,2.3601142375052608e-05,,,15.0,0.0001,30.0,,,,,,,,,,,PRUNED
8,0.2685727065426168,2026-09-09 03:54:28.735034,2026-09-09 04:00:33.790572,0 days 00:06:05.055538,False,batchnorm,2,2.904907257968377e-05,4.0,4.0,10.0,1e-06,20.0,55.0,outputs/hpo_text_regression/screening/trial-0008,0.5128205128205128,0.3297991071428571,1.3076858907683282,0.2299157591945757,0.6878116535523269,0.8293441104585761,9.096060975588736,,COMPLETE
9,0.0698831855322658,2026-09-09 04:00:33.883001,2026-09-09 04:03:07.780397,0 days 00:02:33.897396,True,layernorm,4,1.3716822979925751e-05,,,15.0,1e-05,30.0,,,,,,,,,,,PRUNED
10,0.2955538623657953,2026-09-09 04:03:07.885374,2026-09-09 04:10:15.311595,0 days 00:07:07.426221,False,batchnorm,4,1.2562125931591763e-05,32.0,4.0,15.0,0.0,20.0,75.0,outputs/hpo_text_regression/screening/trial-0010,0.5213675213675214,0.2700892857142857,1.3241956458132491,0.203450242372398,0.6624394073051684,0.8139038071573129,8.92671514907242,,COMPLETE
11,0.107199305061638,2026-09-09 04:10:15.406856,2026-09-09 04:12:43.005555,0 days 00:02:27.598699,True,layernorm,2,1.7916983400985128e-05,,,10.0,0.0001,20.0,,,,,,,,,,,PRUNED
12,0.3211412918552262,2026-09-09 04:12:43.116198,2026-09-09 04:25:13.905873,0 days 00:12:30.789675,False,batchnorm,1,8.590331178462853e-06,8.0,8.0,10.0,0.0001,25.0,130.0,outputs/hpo_text_regression/screening/trial-0012,0.2222222222222222,0.3463541666666667,1.4185825728962564,0.1778177583089973,0.6383777782892635,0.7989854681339726,8.763094141975063,,COMPLETE
13,0.3170964849900409,2026-09-09 04:25:14.004740,2026-09-09 04:37:45.354321,0 days 00:12:31.349581,False,batchnorm,1,8.688416037279446e-06,8.0,8.0,10.0,0.0001,25.0,130.0,outputs/hpo_text_regression/screening/trial-0013,0.2222222222222222,0.3463541666666667,1.419523829068893,0.1762201066697253,0.6421813898349747,0.8013622088886989,8.789161708170836,,COMPLETE
14,0.2454803718552956,2026-09-09 04:37:45.452980,2026-09-09 04:44:19.631668,0 days 00:06:34.178688,False,batchnorm,1,7.795749769718329e-06,8.0,8.0,10.0,0.0001,25.0,,,,,,,,,,,PRUNED
15,0.1706677491535275,2026-09-09 04:44:19.745402,2026-09-09 04:48:30.242132,0 days 00:04:10.496730,False,batchnorm,1,1.2043608094274289e-05,4.0,2.0,20.0,0.0001,30.0,,,,,,,,,,,PRUNED
16,0.2606680820352697,2026-09-09 04:48:30.355127,2026-09-09 04:54:04.297580,0 days 00:05:33.942453,False,batchnorm,4,1.5730137894173754e-05,32.0,1.0,15.0,0.0001,20.0,55.0,outputs/hpo_text_regression/screening/trial-0016,0.5128205128205128,0.3984375,1.330470351072458,0.2840811965811965,0.6952449184875319,0.8338134794350184,9.145079978571111,,COMPLETE
17,0.1884622200568561,2026-09-09 04:54:04.399655,2026-09-09 04:58:15.007109,0 days 00:04:10.607454,False,batchnorm,1,6.7064171494880165e-06,16.0,4.0,10.0,0.0,25.0,,,,,,,,,,,PRUNED
18,0.1600563883531928,2026-09-09 04:58:15.123474,2026-09-09 05:02:10.065073,0 days 00:03:54.941599,False,batchnorm,4,1.0194150859917048e-05,8.0,8.0,10.0,1e-06,20.0,,,,,,,,,,,PRUNED
19,0.1173783507364688,2026-09-09 05:02:10.181205,2026-09-09 05:04:36.825762,0 days 00:02:26.644557,True,layernorm,1,1.8897592900294486e-05,,,15.0,1e-05,25.0,,,,,,,,,,,PRUNED
20,0.1322773343600449,2026-09-09 05:04:36.944690,2026-09-09 05:08:48.464033,0 days 00:04:11.519343,False,batchnorm,2,6.2816621789659955e-06,8.0,8.0,20.0,0.0001,30.0,,,,,,,,,,,PRUNED
21,0.040332927881708,2026-09-09 05:08:48.582244,2026-09-09 05:12:41.747585,0 days 00:03:53.165341,False,batchnorm,4,3.0688883761705024e-06,16.0,4.0,10.0,0.0001,20.0,,,,,,,,,,,PRUNED
22,0.3140532821023729,2026-09-09 05:12:41.866928,2026-09-09 05:21:39.448218,0 days 00:08:57.581290,False,batchnorm,1,9.355685539527788e-06,8.0,8.0,10.0,0.0001,25.0,85.0,outputs/hpo_text_regression/screening/trial-0022,0.2649572649572649,0.3340773809523809,1.4179007273453932,0.1962949688634022,0.6450431239116018,0.8031457675363806,8.8087233548245,,COMPLETE
23,0.3179097540088916,2026-09-09 05:21:39.555509,2026-09-09 05:30:36.932650,0 days 00:08:57.377141,False,batchnorm,1,1.0424707146088607e-05,8.0,8.0,10.0,0.0001,25.0,85.0,outputs/hpo_text_regression/screening/trial-0023,0.2649572649572649,0.3385044642857143,1.4147840666974711,0.2007463360317794,0.6414166167486514,0.800884896067251,8.783926620566051,,COMPLETE
24,0.3212406911109261,2026-09-09 05:30:37.042687,2026-09-09 05:39:34.330144,0 days 00:08:57.287457,False,batchnorm,1,1.083827506268681e-05,8.0,8.0,10.0,0.0001,25.0,85.0,outputs/hpo_text_regression/screening/trial-0024,0.2564102564102564,0.3345982142857143,1.4137100134140406,0.1968840579710145,0.6382843062968503,0.7989269718171056,8.762452539452196,,COMPLETE
25,0.2862110137759368,2026-09-09 05:39:34.443837,2026-09-09 05:44:10.621373,0 days 00:04:36.177536,False,batchnorm,1,2.1678362722212907e-05,8.0,8.0,10.0,0.0001,25.0,30.0,outputs/hpo_text_regression/screening/trial-0025,0.2478632478632478,0.3218377976190476,1.41964871251685,0.1800420168067227,0.6712251337812805,0.8192833049570096,8.985716267791048,,COMPLETE
26,0.21632406206339,2026-09-09 05:44:10.735651,2026-09-09 05:48:07.843629,0 days 00:03:57.107978,False,batchnorm,1,1.4592494719218335e-05,4.0,2.0,15.0,0.0001,25.0,,,,,,,,,,,PRUNED
27,0.0872217320976317,2026-09-09 05:48:07.971910,2026-09-09 05:50:46.748827,0 days 00:02:38.776917,True,layernorm,1,1.1657554227838113e-05,,,10.0,1e-05,25.0,,,,,,,,,,,PRUNED
28,0.2217806869409241,2026-09-09 05:50:46.877831,2026-09-09 05:55:12.719703,0 days 00:04:25.841872,False,batchnorm,1,1.5979794250533087e-05,32.0,1.0,10.0,1e-06,25.0,30.0,outputs/hpo_text_regression/screening/trial-0028,0.5128205128205128,0.3984375,1.3347086417369354,0.2839889579020014,0.7318134246964718,0.8554609428235002,9.382504601498542,,COMPLETE
29,0.1328532163264135,2026-09-09 05:55:12.839570,2026-09-09 05:59:23.355699,0 days 00:04:10.516129,False,batchnorm,2,6.6404639305380536e-06,16.0,4.0,20.0,0.0,30.0,,,,,,,,,,,PRUNED
30,0.158792359234031,2026-09-09 05:59:23.487729,2026-09-09 06:01:38.033096,0 days 00:02:14.545367,True,batchnorm,4,2.9781986084321322e-05,,,15.0,0.0001,20.0,,,,,,,,,,,PRUNED
31,0.1237596408210883,2026-09-09 06:01:38.169095,2026-09-09 06:05:37.691240,0 days 00:03:59.522145,False,batchnorm,4,7.462683953076172e-06,8.0,8.0,15.0,0.0001,25.0,,,,,,,,,,,PRUNED
32,0.3198656395862723,2026-09-09 06:05:37.828621,2026-09-09 06:14:34.921980,0 days 00:08:57.093359,False,batchnorm,1,1.0630765041041398e-05,8.0,8.0,10.0,0.0001,25.0,85.0,outputs/hpo_text_regression/screening/trial-0032,0.2735042735042735,0.3424107142857143,1.4134102356739533,0.2053472637898822,0.6395773623139714,0.7997358078227906,8.771323677790301,,COMPLETE
33,0.3211730420193247,2026-09-09 06:14:35.045561,2026-09-09 06:23:31.870023,0 days 00:08:56.824462,False,batchnorm,1,1.074522623834033e-05,8.0,8.0,10.0,0.0001,25.0,85.0,outputs/hpo_text_regression/screening/trial-0033,0.2735042735042735,0.3424107142857143,1.4135218114934416,0.2059866499791405,0.6383479214148146,0.7989667836742742,8.762889216109983,,COMPLETE
34,0.3192352837129744,2026-09-09 06:23:31.995181,2026-09-09 06:32:29.705050,0 days 00:08:57.709869,False,batchnorm,1,1.014717964113259e-05,8.0,8.0,10.0,0.0001,25.0,85.0,outputs/hpo_text_regression/screening/trial-0034,0.2649572649572649,0.3385044642857143,1.4157911671532526,0.2006770529994176,0.640170129523259,0.8001063238865563,8.775387434960473,,COMPLETE
35,0.20171534663934,2026-09-09 06:32:29.833830,2026-09-09 06:36:41.954543,0 days 00:04:12.120713,False,batchnorm,1,8.72604403090236e-06,8.0,8.0,10.0,0.0001,25.0,,,,,,,,,,,PRUNED
36,0.3251633281170639,2026-09-09 06:36:42.093722,2026-09-09 06:45:39.376096,0 days 00:08:57.282374,False,batchnorm,1,1.1962402885307259e-05,8.0,8.0,10.0,1e-06,25.0,85.0,outputs/hpo_text_regression/screening/trial-0036,0.2735042735042735,0.3468377976190476,1.4097979119700244,0.211515807873537,0.6345955795161966,0.7966150761291155,8.737096202197922,,COMPLETE
37,0.1328798610612979,2026-09-09 06:45:39.509638,2026-09-09 06:49:51.735181,0 days 00:04:12.225543,False,batchnorm,1,5.743647469402934e-06,8.0,8.0,10.0,1e-06,25.0,,,,,,,,,,,PRUNED
38,0.1530067108500417,2026-09-09 06:49:51.882260,2026-09-09 06:54:01.791550,0 days 00:04:09.909290,False,layernorm,1,1.2874702836714366e-05,8.0,2.0,10.0,1e-06,25.0,,,,,,,,,,,PRUNED
39,0.1857502633007168,2026-09-09 06:54:01.954205,2026-09-09 06:58:14.029749,0 days 00:04:12.075544,False,batchnorm,1,7.897797944116675e-06,8.0,8.0,10.0,1e-06,25.0,,,,,,,,,,,PRUNED
40,0.1082886643236801,2026-09-09 06:58:14.176004,2026-09-09 07:00:57.869562,0 days 00:02:43.693558,True,batchnorm,1,1.1282779010834489e-05,,,10.0,1e-06,25.0,,,,,,,,,,,PRUNED
41,0.1170327247239474,2026-09-09 07:00:58.027078,2026-09-09 07:04:51.172240,0 days 00:03:53.145162,False,layernorm,1,4.9603534268404255e-06,8.0,8.0,20.0,1e-05,25.0,,,,,,,,,,,PRUNED
42,0.2113718541842493,2026-09-09 07:04:51.318645,2026-09-09 07:09:03.587297,0 days 00:04:12.268652,False,batchnorm,1,9.295312484085225e-06,8.0,8.0,10.0,0.0001,25.0,,,,,,,,,,,PRUNED
43,0.3195655315575157,2026-09-09 07:09:03.738589,2026-09-09 07:18:00.889673,0 days 00:08:57.151084,False,batchnorm,1,1.0761957487332344e-05,8.0,8.0,10.0,0.0001,25.0,85.0,outputs/hpo_text_regression/screening/trial-0043,0.2649572649572649,0.3385044642857143,1.4139669145274365,0.2013674540442018,0.6398595746423188,0.7999122293366434,8.773258638720074,,COMPLETE
44,0.3113011229527486,2026-09-09 07:18:01.028563,2026-09-09 07:24:58.224579,0 days 00:06:57.196016,False,batchnorm,1,1.3815213709197044e-05,8.0,8.0,10.0,0.0,25.0,,,,,,,,,,,PRUNED
45,0.2022575272359703,2026-09-09 07:24:58.379321,2026-09-09 07:29:01.212121,0 days 00:04:02.832800,False,batchnorm,1,9.358723835476984e-06,8.0,1.0,10.0,1e-06,25.0,,,,,,,,,,,PRUNED
46,0.3209761767836846,2026-09-09 07:29:01.366210,2026-09-09 07:37:59.887964,0 days 00:08:58.521754,False,batchnorm,2,1.3087267065053425e-05,8.0,8.0,10.0,0.0001,25.0,85.0,outputs/hpo_text_regression/screening/trial-0046,0.2905982905982906,0.3413690476190476,1.4225913510363326,0.2054828660436137,0.6385330474067811,0.7990826286478646,8.76415976788967,,COMPLETE
47,0.0837326881596691,2026-09-09 07:38:00.034474,2026-09-09 07:42:31.417571,0 days 00:04:31.383097,False,batchnorm,2,1.8256900511451604e-05,4.0,8.0,10.0,0.0001,30.0,,,,,,,,,,,PRUNED
48,0.2978172223363643,2026-09-09 07:42:31.626344,2026-09-09 07:49:29.042334,0 days 00:06:57.415990,False,batchnorm,2,1.2629496040544554e-05,32.0,8.0,10.0,0.0001,25.0,,,,,,,,,,,PRUNED
49,0.0753456100471884,2026-09-09 07:49:29.202999,2026-09-09 07:52:05.633637,0 days 00:02:36.430638,True,layernorm,2,1.4182807332257735e-05,,,10.0,1e-05,25.0,,,,,,,,,,,PRUNED
